{
    "$schema": "./schema/bot-config.schema.json",
    "loopDelay": 5000,
    "contractsJsonFile": "./fasset-deployment/coston.json",
    "nativeChainInfo": { "finalizationBlocks": 6, "readLogsChunkSize": 10 },
    "fAssetInfos": [
        {
            "chainId": "testXRP",
            "name": "Test XRP",
            "symbol": "testXRP",
            "decimals": 6,
            "amgDecimals": 0,
            "finalizationBlocks": 3,
            "requireEOAProof": false,
            "fAssetSymbol": "FtestXRP",
            "indexerUrl": "https://attestation-coston.aflabs.net/verifier/xrp"
        },
        {
            "chainId": "testXRP",
            "name": "Fake XRP",
            "symbol": "fakeXRP",
            "decimals": 6,
            "amgDecimals": 0,
            "finalizationBlocks": 10,
            "requireEOAProof": false,
            "fAssetSymbol": "FfakeXRP",
            "indexerUrl": "https://attestation-coston.aflabs.net/verifier/xrp",
            "priceChangeEmitter": "FakePriceReader"
        }
    ],
    "rpcUrl": "https://coston-api.flare.network/ext/C/rpc",
    "attestationProviderUrls": ["https://attestation-coston.aflabs.net/attestation-client"],
    "challengeStrategy": {
        "className": "DexChallengeStrategy",
        "config": {
            "address": "0xbDcCb53d655f541902De8cf04e68B6E7cE2D9Fa0"
        }
    }
}
