{
    "$schema": "./schema/bot-config.schema.json",
    "loopDelay": 5000,
    "contractsJsonFile": "./fasset-deployment/coston.json",
    "nativeChainInfo": {
        "finalizationBlocks": 6,
        "readLogsChunkSize": 10
    },
    "fAssetInfos": [
        {
            "chainId": "testXRP",
            "name": "Test XRP",
            "symbol": "testXRP",
            "decimals": 6,
            "amgDecimals": 0,
            "finalizationBlocks": 3,
            "requireEOAProof": false,
            "fAssetSymbol": "FtestXRP",
            "indexerUrl": "https://attestation-coston.aflabs.net/verifier/xrp",
            "walletUrl": "https://s.altnet.rippletest.net:51234"
        },
        {
            "chainId": "testXRP",
            "name": "Fake XRP",
            "symbol": "fakeXRP",
            "decimals": 6,
            "amgDecimals": 0,
            "finalizationBlocks": 10,
            "requireEOAProof": false,
            "fAssetSymbol": "FfakeXRP",
            "indexerUrl": "https://attestation-coston.aflabs.net/verifier/xrp",
            "walletUrl": "https://s.altnet.rippletest.net:51234",
            "priceChangeEmitter": "FakePriceReader"
        }
    ],
    "ormOptions": {
        "type": "sqlite",
        "dbName": "fasset-bots-coston.db",
        "allowGlobalContext": true
    },
    "rpcUrl": "https://coston-api.flare.network/ext/C/rpc",
    "attestationProviderUrls": ["https://attestation-coston.aflabs.net/attestation-client"],
    "defaultAgentSettingsPath": "./run-config/agent-settings-config.json"
}
